{
  "pact": "0.3",
  "type": "FacilitatorCapabilities",
  "facilitator": "did:web:settle.example",
  "issued_at": "2026-11-01T09:00:00Z",
  "settlement_bindings": [
    {
      "id": "https://settle.example/bindings/ledger-1",
      "networks": [
        "eip155:8453"
      ],
      "assets": [
        "USDC"
      ]
    }
  ],
  "flows": [
    "verdict-first",
    "delivery-first"
  ],
  "verification_profiles": [
    "acceptance"
  ],
  "terms_profiles": [
    {
      "id": "tag:laxsharma79@gmail.com,2026:pact:bonded-restitution",
      "profile_hash": "sha256:c6b85fc09b885fb082e79a2e833356628e77c18a3211f81fc0accf8b07057192"
    }
  ],
  "max_contract_value": {
    "amount": "50000.00",
    "currency": "USDC"
  },
  "endpoints": {
    "contract": "https://settle.example/pact/v2/contracts",
    "delivery": "https://settle.example/pact/v2/deliveries",
    "verdict": "https://settle.example/pact/v2/verdicts",
    "challenge": "https://settle.example/pact/v2/challenges",
    "outcome": "https://settle.example/pact/v2/outcomes"
  },
  "signature": {
    "protected": "eyJhbGciOiJFZDI1NTE5Iiwia2lkIjoiZGlkOndlYjpzZXR0bGUuZXhhbXBsZSNrMSIsInR5cCI6ImFwcGxpY2F0aW9uL3ZuZC5wYWN0LmZhY2lsaXRhdG9yK2pzb24ifQ",
    "signature": "eFDS2zwP3Wv418K2DkS3O0yTu01tMx1cU6QyV7ePtQ2Snlvrj430X2JiIjI0wsvPKkN5Avy65oikoAWTM7SwBQ"
  }
}
